Author,n (strains),publication title,journal,publication URL,strains
Odia et al,60,Lassa Virus Outbreak Genomics And Epidemiology From Nigeria,Unpublished,unknown,NGA/2016/ISTH_0187 NGA/2016/ISTH_0717 NGA/2016/ISTH_0917 NGA/2016/ISTH_1604 NGA/2015/ISTH_0831 NGA/2015/ISTH_0789 NGA/2016/ISTH_0419 NGA/2016/ISTH_1541 NGA/2016/ISTH_1609 NGA/2016/ISTH_1546 NGA/2016/ISTH_0621 NGA/2016/ISTH_0104 NGA/2016/ISTH_0133 NGA/2016/ISTH_1150 NGA/2016/ISTH_1311 NGA/2016/ISTH_0777 NGA/2016/ISTH_0565 NGA/2016/ISTH_0543 NGA/2016/ISTH_1423 NGA/2016/ISTH_1610 NGA/2016/ISTH_0759 NGA/2016/ISTH_1069 NGA/2016/ISTH_1123 NGA/2016/ISTH_1250 NGA/2016/ISTH_1398 NGA/2016/ISTH_0610 NGA/2016/ISTH_1070 NGA/2015/ISTH_0682 NGA/2016/ISTH_0702 NGA/2016/ISTH_1006 NGA/2016/ISTH_0572 NGA/2015/ISTH_0574 NGA/2016/ISTH_1472 NGA/2016/ISTH_1474 NGA/2016/ISTH_0703 NGA/2016/ISTH_1462 NGA/2016/ISTH_0753 NGA/2016/ISTH_1591 NGA/2016/ISTH_1174 NGA/2016/ISTH_0176 NGA/2016/ISTH_0146 NGA/2016/ISTH_1568 NGA/2016/ISTH_0035 NGA/2016/ISTH_0017 NGA/2015/ISTH_0681 NGA/2015/ISTH_0547 NGA/2015/ISTH_0687 NGA/2016/ISTH_0141 NGA/2016/ISTH_0447 NGA/2015/ISTH_0821 NGA/2016/ISTH_0199 NGA/2016/ISTH_0919 NGA/2016/ISTH_0701 NGA/2016/ISTH_1026 NGA/2016/ISTH_1306 NGA/2016/ISTH_1496 NGA/2015/ISTH_0736 NGA/2016/ISTH_1207 NGA/2016/ISTH_0009 NGA/2015/ISTH_0543
Safronetz et al,2,Geographic Distribution And Genetic Characterization Of Lassa Virus In Sub-saharan Mali,Plos Negl Trop Dis 7  12  E2582  2013 ,https://www.ncbi.nlm.nih.gov/pubmed/24340119,Soromba_R Bamba_R114
Rieger et al,1,Direct Submission,Submitted  23-mar-2016  Who Collaborating Centre For Arboviruses And Hemorrhagic Fever Reference And Research Bernhard Nocht Institute For Tropical Medicine Bernhard-nocht-str. 74 Hamburg 20359 Germany,unknown,Togo/2016/7082
Olschlager et al,1,Improved Detection Of Lassa Virus By Reverse Transcription-pcr Targeting The 5  Region Of S Rna,J. Clin. Microbiol. 48  6  2009-2013  2010 ,https://www.ncbi.nlm.nih.gov/pubmed/20351210,BA366
Whitmer et al,1,New Lineage Of Lassa Virus Togo 2016,Emerging Infect. Dis. 24  3  599-602  2018 ,https://www.ncbi.nlm.nih.gov/pubmed/29460758,Lassa/TGO/2016/812939
Ehichioya et al,6,Current Molecular Epidemiology Of Lassa Virus In Nigeria,J. Clin. Microbiol. 49  3  1157-1161  2011 ,https://www.ncbi.nlm.nih.gov/pubmed/21191050,Nig08_A19 Nig08_A18 Nig08_04 Nig08_A47 Nig08_A37 Nig08_A41
Andersen et al,195,Whole Genome-sequencing From Clinical And Field Samples Uncovers Ancient Origins And Intra-host Evolution Of Lassa Virus,Unpublished,unknown,ISTH2121_NIG_2012 G2141_SLE_2011 G2557_SLE_2012 G2230_SLE_2012 G2259_SLE_2012 G2615_SLE_2012 G3278_SLE_2013 G2723_SLE_2012 G2789_SLE_2012 G1200_LIB_2010 G3034_SLE_2013 G2363_SLE_2012 G3234_SLE_2013 G1529_SLE_2011 G2431_SLE_2012 G1442_SLE_2011 G2263_SLE_2012 G2554_SLE_2012 G733_SLE_2010 G1646_SLE_2011 G1618_SLE_2011 G2427_SLE_2012 G2392_SLE_2012 G3110_SLE_2013 G3253_SLE_2013 G3229_SLE_2013 G3222_SLE_2013 G3151_SLE_2013 G3248_SLE_2013 G3170_SLE_2013 G2318_SLE_2012 G503_SLE_2009 G2147_SLE_2011 G502_SLE_2009 G1180_SLE_2010 LM032_SLE_2010 G2197_SLE_2011 G610_SLE_2009 G693_SLE_2009 G771_SLE_2010 G2934_SLE_2012 G2565_SLE_2012 G1792_SLE_2011 G1960_SLE_2011 G3010_SLE_2013 G1959_SLE_2011 G2906_SLE_2012 G2184_SLE_2011 LM771_SLE_2012 LM776_SLE_2012 G2384_SLE_2012 G2165_SLE_2011 LM222_SLE_2010 LM774_SLE_2012 LM778_SLE_2012 G2868_SLE_2012 G808_SLE_2010 G3206_SLE_2013 G2903_SLE_2012 G2315_SLE_2012 G636_SLE_2009 LM395_SLE_2009 G1774_SLE_2011 G806_SLE_2010 G2222_SLE_2011 G692_SLE_2009 LM779_SLE_2012 G1897_SLE_2011 G2612_SLE_2012 G2280_SLE_2012 G3106_SLE_2013 G3016_SLE_2013 G1647_SLE_2011 G1932_SLE_2011 G2511_SLE_2012 G2587_SLE_2012 G2295_SLE_2012 G676_SLE_2009 G2405_SLE_2012 G3076_SLE_2013 G1727_SLE_2011 LM765_SLE_2012 G1190_SLE_2010 G2944_SLE_2012 G3101_SLE_2013 Z0948_SLE_2011 Z0947_SLE_2011 G3148_SLE_2013 G3157_SLE_2013 G3283_SLE_2013 Pinneo_NIG_1969 ISTH2069_NIG_2012 ISTH2065_NIG_2012 ISTH2066_NIG_2012 ISTH2094_NIG_2012 ISTH2271_NIG_2012 ISTH1121_NIG_2012 ISTH1107_NIG_2012 035_NIG_2009 250_NIG_2011 1015_NIG_2009 ISTH2025_NIG_2012 ISTH1048_NIG_2011 045_NIG_2009 978_NIG_2009 ISTH2316_NIG_2012 225_NIG_2010 ISTH1003_NIG_2011 ISTH0073_NIG_2011 990_NIG_2009 ISTH0047_NIG_2011 989_NIG_2009 251_NIG_2010 003_NIG_2008 253_NIG_2011 242_NIG_2010 982_NIG_2009 ISTH1058_NIG_2011 271_NIG_2010 241_NIG_2011 993_NIG_2009 ISTH0012_NIG_2011 ISTH2046_NIG_2012 1008_NIG_2009 ISTH2020_NIG_2012 966_NIG_2009 ISTH2358_NIG_2012 254_NIG_2011 ISTH0531_NIG_2011 049_NIG_2009 ISTH2037_NIG_2012 239_NIG_2010 ISTH1069_NIG_2011 736_NIG_2009 246_NIG_2010 ISTH1129_NIG_2012 ISTH2304_NIG_2012 ISTH1111_NIG_2011 006_NIG_2008 991_NIG_2009 267_NIG_2010 ISTH2050_NIG_2012 ISTH2376_NIG_2012 ISTH2031_NIG_2012 967_NIG_2009 224_NIG_2010 971_NIG_2009 ISTH0595_NIG_2011 ISTH1096_NIG_2012 221_NIG_2010 977_NIG_2009 716_NIG_2009 ISTH2064_NIG_2012 063_NIG_2009 052_NIG_2008 256_NIG_2010 981_NIG_2009 042_NIG_2009 056_NIG_2008 ISTH1038_NIG_2011 ISTH2057_NIG_2012 058_NIG_2008 ISTH2129_NIG_2012 229_NIG_2010 969_NIG_2009 ISTH1137_NIG_2011 263_NIG_2011 274_NIG_2010 719_NIG_2009 046_NIG_2009 ISTH2042_NIG_2012 ISTH2010_NIG_2012 ISTH2016_NIG_2012 737_NIG_2009 1000_NIG_2009 738_NIG_2009 976_NIG_2009 1016_NIG_2009 1011_NIG_2009 ISTH1064_NIG_2011 ISTH2334_NIG_2012 245_NIG_2011 746_NIG_2009 ISTH2312_NIG_2012 ISTH2217_NIG_2012 ISTH2061_NIG_2012 ISTH0964_NIG_2011 975_NIG_2009 988_NIG_2009 ISTH0230_NIG_2011 237_NIG_2010 ISTH0009_NIG_2011 979_NIG_2009 711_NIG_2009 992_NIG_2009